{
  "schema": "avengine_room_package_v1",
  "room_id": "habitat_test_skokloster_castle",
  "room_kind": "habitat_native",
  "geometry_representation": "real_surface_mesh",
  "coordinate_system": {
    "handedness": "right",
    "up_axis": "+Y",
    "forward_axis": "-Z",
    "linear_unit": "meter",
    "quaternion_order": "xyzw"
  },
  "scene": {
    "scene_id_kind": "path",
    "scene_id": "${AVENGINE_HABITAT_RUNTIME_ROOT}/data/versioned_data/habitat_test_scenes_v1.0/skokloster-castle.glb",
    "dataset_config_path": "${AVENGINE_REPOSITORY_ROOT}/examples/acoustics/skokloster_castle/skokloster_castle.scene_dataset_config.json",
    "navmesh_path": "${AVENGINE_HABITAT_RUNTIME_ROOT}/data/versioned_data/habitat_test_scenes_v1.0/skokloster-castle.navmesh",
    "navmesh_policy": "load_declared",
    "load_semantic_mesh": false,
    "enable_physics": false
  },
  "assets": [
    {
      "role": "render_surface_mesh",
      "path": "${AVENGINE_HABITAT_RUNTIME_ROOT}/data/versioned_data/habitat_test_scenes_v1.0/skokloster-castle.glb",
      "license": "Creative Commons Attribution 4.0 International (CC BY 4.0); The King's Hall by Skokloster Castle (Skoklosters slott)",
      "redistribution": "external_Habitat_test_asset_not_committed; preserve title, author, source URL, and CC BY 4.0 attribution"
    },
    {
      "role": "scene_dataset_config",
      "path": "${AVENGINE_REPOSITORY_ROOT}/examples/acoustics/skokloster_castle/skokloster_castle.scene_dataset_config.json",
      "license": "AVEngine-authored configuration; paired external scene remains CC BY 4.0",
      "redistribution": "configuration_committable; external GLB is not committed"
    },
    {
      "role": "navmesh",
      "path": "${AVENGINE_HABITAT_RUNTIME_ROOT}/data/versioned_data/habitat_test_scenes_v1.0/skokloster-castle.navmesh",
      "license": "Paired Habitat test-scene derivative; retain the source scene CC BY 4.0 attribution",
      "redistribution": "external_Habitat_test_asset_not_committed"
    }
  ],
  "semantics": {
    "interpretation": "No semantic mesh is supplied; the single visual material slot is not a physical acoustic label"
  },
  "navigation": {
    "agent_height_m": 1.5,
    "agent_radius_m": 0.1,
    "include_static_objects": false
  },
  "openings": [],
  "connectivity_pairs": [
    {
      "pair_id": "listener_to_source1_root",
      "start_m": [3.93178129196167, 0.1583894044160843, 9.969188690185547],
      "end_m": [2.4000000953674316, 0.13626886904239655, 10.399999618530273]
    },
    {
      "pair_id": "listener_to_source2_root",
      "start_m": [3.93178129196167, 0.1583894044160843, 9.969188690185547],
      "end_m": [2.700000047683716, 0.11579117923974991, 8.899999618530273]
    }
  ],
  "ray_checks": [
    {
      "check_id": "listener_floor_control",
      "origin_m": [3.93178129196167, 1.6583894044160843, 9.969188690185547],
      "direction": [0.0, -1.0, 0.0],
      "expectation": "hit_within_m",
      "distance_m": 2.0
    },
    {
      "check_id": "source1_mouth_floor_control",
      "origin_m": [2.4000000953674316, 1.7462688690423965, 10.399999618530273],
      "direction": [0.0, -1.0, 0.0],
      "expectation": "hit_within_m",
      "distance_m": 2.0
    },
    {
      "check_id": "source2_mouth_floor_control",
      "origin_m": [2.700000047683716, 1.684803630816874, 8.899999618530273],
      "direction": [0.0, -1.0, 0.0],
      "expectation": "hit_within_m",
      "distance_m": 2.0
    }
  ],
  "acoustics": {
    "status": "deferred_to_m3",
    "reason": "Only a non-physical research placeholder material is assigned until the source surface is acoustically reviewed"
  },
  "provenance": {
    "source": "Habitat-Sim official habitat_test_scenes_v1.0 package",
    "source_revision": "habitat_test_scenes_v1.0",
    "asset_title": "The King's Hall",
    "asset_author": "Skokloster Castle (Skoklosters slott)",
    "asset_source_url": "https://sketchfab.com/3d-models/the-king-s-hall-d18155613363445b9b68c0c67196d98d",
    "asset_author_url": "https://sketchfab.com/SkoklosterCastle",
    "asset_license": "Creative Commons Attribution 4.0 International (CC BY 4.0)",
    "asset_license_url": "https://creativecommons.org/licenses/by/4.0/",
    "coordinate_evidence": "GLB source POSITION bounds and the official navmesh bounds align only under H=(S.x,S.z,-S.y)",
    "topology_caveat": "The research cleanup removes only two RLR-degenerate faces; 855 exact-weld boundary edges and 3 exact-weld nonmanifold edges remain declared and are never filled"
  },
  "surface_audit": {
    "method": "expanded GLB triangle audit plus exact-weld edge incidence",
    "aabb_proxy": false,
    "source_triangle_count": 999983,
    "source_degenerate_triangle_count": 2,
    "source_duplicate_triangle_count": 0,
    "source_boundary_edge_count_after_exact_weld": 855,
    "source_nonmanifold_edge_count_after_exact_weld": 3,
    "cleanup_policy": "remove_only_RLR_incompatible_faces_no_hole_filling",
    "qualification_claim": false
  }
}
